{
  "execution_id": "99095b1922c9",
  "model_id": "model_CALIB_03",
  "status": "success",
  "inputs": {},
  "outputs": {
    "optimal_decision": "queue",
    "optimal_decision_cn": "前往到达区排队等待载客",
    "profit_queue": 79.8,
    "profit_city": -5.0,
    "profit_diff": 84.8,
    "expected_wait_min": 0.1,
    "queue_length_avg": 3.0,
    "rho_utilization": 0.75,
    "queue_stable": true,
    "lambda_critical": 39.98,
    "n_taxis_in_pool": 50,
    "decision_scan": [
      {
        "lambda": 10,
        "wait_min": 0.03,
        "profit_queue": 79.93,
        "profit_city": -5.0,
        "optimal": "queue"
      },
      {
        "lambda": 15,
        "wait_min": 0.04,
        "profit_queue": 79.92,
        "profit_city": -5.0,
        "optimal": "queue"
      },
      {
        "lambda": 20,
        "wait_min": 0.05,
        "profit_queue": 79.9,
        "profit_city": -5.0,
        "optimal": "queue"
      },
      {
        "lambda": 25,
        "wait_min": 0.07,
        "profit_queue": 79.87,
        "profit_city": -5.0,
        "optimal": "queue"
      },
      {
        "lambda": 28,
        "wait_min": 0.08,
        "profit_queue": 79.83,
        "profit_city": -5.0,
        "optimal": "queue"
      },
      {
        "lambda": 30,
        "wait_min": 0.1,
        "profit_queue": 79.8,
        "profit_city": -5.0,
        "optimal": "queue"
      },
      {
        "lambda": 32,
        "wait_min": 0.12,
        "profit_queue": 79.75,
        "profit_city": -5.0,
        "optimal": "queue"
      },
      {
        "lambda": 35,
        "wait_min": 0.2,
        "profit_queue": 79.6,
        "profit_city": -5.0,
        "optimal": "queue"
      },
      {
        "lambda": 38,
        "wait_min": 0.5,
        "profit_queue": 79.0,
        "profit_city": -5.0,
        "optimal": "queue"
      }
    ]
  },
  "stdout": "{\"optimal_decision\": \"queue\", \"optimal_decision_cn\": \"前往到达区排队等待载客\", \"profit_queue\": 79.8, \"profit_city\": -5.0, \"profit_diff\": 84.8, \"expected_wait_min\": 0.1, \"queue_length_avg\": 3.0, \"rho_utilization\": 0.75, \"queue_stable\": true, \"lambda_critical\": 39.98, \"n_taxis_in_pool\": 50, \"decision_scan\": [{\"lambda\": 10, \"wait_min\": 0.03, \"profit_queue\": 79.93, \"profit_city\": -5.0, \"optimal\": \"queue\"}, {\"lambda\": 15, \"wait_min\": 0.04, \"profit_queue\": 79.92, \"profit_city\": -5.0, \"optimal\": \"queue\"}, {\"lambda\": 20, \"wait_min\": 0.05, \"profit_queue\": 79.9, \"profit_city\": -5.0, \"optimal\": \"queue\"}, {\"lambda\": 25, \"wait_min\": 0.07, \"profit_queue\": 79.87, \"profit_city\": -5.0, \"optimal\": \"queue\"}, {\"lambda\": 28, \"wait_min\": 0.08, \"profit_queue\": 79.83, \"profit_city\": -5.0, \"optimal\": \"queue\"}, {\"lambda\": 30, \"wait_min\": 0.1, \"profit_queue\": 79.8, \"profit_city\": -5.0, \"optimal\": \"queue\"}, {\"lambda\": 32, \"wait_min\": 0.12, \"profit_queue\": 79.75, \"profit_city\": -5.0, \"optimal\": \"queue\"}, {\"lambda\": 35, \"wait_min\": 0.2, \"profit_queue\": 79.6, \"profit_city\": -5.0, \"optimal\": \"queue\"}, {\"lambda\": 38, \"wait_min\": 0.5, \"profit_queue\": 79.0, \"profit_city\": -5.0, \"optimal\": \"queue\"}]}\n",
  "stderr": "",
  "returncode": 0,
  "duration_ms": 56,
  "code_hash": "0e57dd35ad658934899923f091c160dd85c2da8bb34d7cfa0360101aa1d74b1e",
  "environment_hash": "fd3a9026b2863096bbc4ef6ff142b29d11083f7cdbbd8fa638ce3e05b19e8fc2",
  "started_at": "2026-09-09T14:54:50+0800",
  "finished_at": "2026-09-09T14:54:50+0800",
  "provenance": {
    "adapter": "local_python",
    "python": "C:\\Users\\Lin\\AppData\\Local\\Programs\\Python\\Python312\\python.exe"
  },
  "code": "\"\"\"2019_C 机场出租车决策 — M/M/1排队模型+收益比较（自包含，纯标准库）。\"\"\"\nimport json\nimport math\n\ndef solve(inputs: dict) -> dict:\n    # 系统参数\n    lambda_pass = 30.0    # 乘客到达率（人/分钟）\n    mu_taxi = 40.0        # 出租车服务率（辆/分钟，含上车时间）\n    avg_fare_queue = 80.0  # 排队载客平均车费（元）\n    avg_fare_city = 50.0   # 放空回市区拉客平均车费（元）\n    waiting_cost = 1.5     # 等待时间成本（元/分钟，含燃油+机会成本）\n    empty_cost = 25.0      # 放空回市区成本（元，含燃油+时间）\n    fuel_idle = 0.5        # 怠速燃油成本（元/分钟）\n    n_taxis_pool = 50      # 蓄车池已有出租车数\n\n    # M/M/1 排队分析\n    rho = lambda_pass / mu_taxi\n    if rho >= 1.0:\n        W_q = float(\"inf\")\n        L_q = float(\"inf\")\n        queue_stable = False\n    else:\n        W_q = 1.0 / (mu_taxi - lambda_pass)  # 平均等待时间（分钟）\n        L_q = lambda_pass / (mu_taxi - lambda_pass)  # 平均排队长度\n        queue_stable = True\n\n    # 排队策略期望收益\n    profit_queue = avg_fare_queue - (waiting_cost + fuel_idle) * W_q\n\n    # 放空回市区策略期望收益\n    time_city = 20.0  # 回市区+拉客平均时间（分钟）\n    profit_city = avg_fare_city - empty_cost - waiting_cost * time_city\n\n    # 决策\n    if profit_queue > profit_city:\n        decision = \"queue\"\n        decision_cn = \"前往到达区排队等待载客\"\n    else:\n        decision = \"return\"\n        decision_cn = \"直接放空返回市区拉客\"\n\n    # 临界到达率（排队收益=放空收益时的lambda）\n    # profit_queue = fare_q - (wc+fi)/(mu-lambda) = profit_city\n    # => 1/(mu-lambda) = (fare_q - profit_city)/(wc+fi)\n    diff = avg_fare_queue - profit_city\n    if diff > 0 and (waiting_cost + fuel_idle) > 0:\n        lambda_crit = mu_taxi - (waiting_cost + fuel_idle) / diff\n    else:\n        lambda_crit = 0.0\n\n    # 不同到达率下的决策扫描\n    scan = []\n    for lam in [10, 15, 20, 25, 28, 30, 32, 35, 38]:\n        if lam < mu_taxi:\n            w = 1.0 / (mu_taxi - lam)\n            pq = avg_fare_queue - (waiting_cost + fuel_idle) * w\n        else:\n            w = float(\"inf\")\n            pq = float(\"-inf\")\n        scan.append({\n            \"lambda\": lam,\n            \"wait_min\": round(w, 2) if w != float(\"inf\") else None,\n            \"profit_queue\": round(pq, 2) if pq != float(\"-inf\") else None,\n            \"profit_city\": round(profit_city, 2),\n            \"optimal\": \"queue\" if pq > profit_city else \"return\"\n        })\n\n    return {\n        \"optimal_decision\": decision,\n        \"optimal_decision_cn\": decision_cn,\n        \"profit_queue\": round(profit_queue, 2),\n        \"profit_city\": round(profit_city, 2),\n        \"profit_diff\": round(profit_queue - profit_city, 2),\n        \"expected_wait_min\": round(W_q, 2) if queue_stable else None,\n        \"queue_length_avg\": round(L_q, 2) if queue_stable else None,\n        \"rho_utilization\": round(rho, 4),\n        \"queue_stable\": queue_stable,\n        \"lambda_critical\": round(lambda_crit, 2),\n        \"n_taxis_in_pool\": n_taxis_pool,\n        \"decision_scan\": scan,\n    }\n\nif __name__ == \"__main__\":\n    print(json.dumps(solve({}), ensure_ascii=False))\n",
  "environment_manifest": "python=3.12.10\nplatform=Windows-11-10.0.26200-SP0\nexecutable=C:\\Users\\Lin\\AppData\\Local\\Programs\\Python\\Python312\\python.exe"
}
